{
  "name": "aib",
  "country": "ie",
  "localTitle": "AIB Bank",
  "engTitle": "AIB Bank",
  "url": "https://aib.ie",
  "color": "#7f2b7b",
  "prefixes": [
    402344,
    402345,
    402346,
    402347,
    402348,
    402349,
    403023,
    406410,
    406411,
    406412,
    408531,
    408569,
    408570,
    409810,
    414261,
    414262,
    426023,
    426397,
    426398,
    427377,
    431947,
    440260,
    454453,
    454454,
    454455,
    454456,
    454457,
    454458,
    455073,
    455263,
    455373,
    471560,
    473664,
    473665,
    473666,
    474198,
    474199,
    492109,
    492177,
    496621,
    496662,
    510213,
    540410,
    540459,
    542523,
    544156,
    544157,
    545155,
    630493,
    630494,
    670695
  ]
}
