{
  "name": "cmb",
  "country": "cn",
  "localTitle": "招商银行",
  "engTitle": "China Merchants Bank",
  "url": "http://www.cmbchina.com",
  "color": "#b0110c",
  "prefixes": [
    356885,
    356886,
    356889,
    356890,
    439188,
    439225,
    439226,
    439227,
    439228,
    439229,
    479229,
    518710,
    518718,
    521302,
    545619,
    545623,
    545947,
    545948,
    552534,
    552580,
    552581,
    552582,
    552583,
    552584,
    552585,
    552586,
    552588,
    552589,
    622575,
    622576,
    622577,
    622578,
    622579,
    622581,
    622588,
    628262,
    628362,
    645621
  ]
}
