{
  "name": "teb",
  "country": "tr",
  "localTitle": "Türk Ekonomi Bankası",
  "engTitle": "Türk Ekonomi Bankası",
  "url": "http://teb.com.tr/",
  "color": "#4285f4",
  "prefixes": [
    402458,
    402459,
    406015,
    427707,
    440247,
    440273,
    440293,
    440294,
    479227,
    489494,
    489495,
    489496,
    510138,
    510139,
    510221,
    512753,
    512803,
    524346,
    524839,
    524840,
    528920,
    530853,
    545124,
    553090
  ]
}
