{
  "name": "raiffeisen",
  "country": "ru",
  "localTitle": "Райффайзенбанк",
  "engTitle": "Raiffeisenbank",
  "url": "http://www.raiffeisen.ru/",
  "color": "#fff300",
  "prefixes": [
    446917,
    447624,
    462729,
    462730,
    462758,
    510069,
    510070,
    515876,
    533594
  ]
}
