{
  "name": "hsbc",
  "country": "tr",
  "localTitle": "HSBC",
  "engTitle": "HSBC",
  "url": "https://hsbc.com.tr/",
  "color": "#4285f4",
  "prefixes": [
    405913,
    405917,
    405918,
    409071,
    422629,
    424909,
    428240,
    496019,
    510005,
    512651,
    519399,
    521045,
    522054,
    525413,
    525795,
    540643,
    542254,
    545183,
    550472,
    550473,
    552143,
    556030,
    556031,
    556033,
    556034,
    556665
  ]
}
