{
  "name": "akbank",
  "country": "tr",
  "localTitle": "Akbank",
  "engTitle": "Akbank",
  "url": "https://akbank.com",
  "color": "#4285f4",
  "prefixes": [
    413252,
    425669,
    432072,
    435508,
    435509,
    493837,
    512754,
    520932,
    521807,
    524347,
    542110,
    552608,
    552609,
    553056,
    557113,
    557829
  ]
}
