{
  "name": "denizbank",
  "country": "tr",
  "localTitle": "Denizbank",
  "engTitle": "Denizbank",
  "url": "http://denizbank.com/",
  "color": "#4285f4",
  "prefixes": [
    403134,
    408625,
    409070,
    411924,
    423667,
    424360,
    424361,
    426391,
    426392,
    441139,
    450050,
    450051,
    460345,
    460347,
    472914,
    489456,
    510063,
    510118,
    510119,
    512017,
    512117,
    514924,
    520019,
    520303,
    521376,
    543358,
    543400,
    543427,
    544127,
    544445,
    544460,
    546764,
    547712,
    549220,
    554483,
    558514
  ]
}
