{
  "name": "ctbcbank",
  "country": "tw",
  "localTitle": "中國信託商業銀行",
  "engTitle": "CTBC Bank",
  "url": "https://www.ctbcbank.com",
  "color": "#007d7d",
  "prefixes": [
    400361,
    406586,
    416217,
    418230,
    421013,
    421016,
    421599,
    430451,
    431195,
    447757,
    451873,
    456301,
    456319,
    481537,
    483515,
    515352,
    517357,
    523953,
    533785,
    533786,
    537675,
    537805,
    540829,
    543372,
    546697,
    547785,
    552049,
    558888,
    559569
  ]
}
