{
  "name": "vakifbank",
  "country": "tr",
  "localTitle": "Vakıf Bank",
  "engTitle": "Vakıf Bank",
  "url": "https://vakifbank.com.tr/",
  "color": "#4285f4",
  "prefixes": [
    402940,
    409084,
    411724,
    411942,
    411943,
    411944,
    411979,
    415792,
    416757,
    428945,
    493840,
    493841,
    493846,
    520017,
    540045,
    540046,
    542119,
    542798,
    542804,
    547244,
    552101
  ]
}
