{
  "name": "sekerbank",
  "country": "tr",
  "localTitle": "Şeker Bank",
  "engTitle": "Şeker Bank",
  "url": "http://sekerbank.com.tr/",
  "color": "#4285f4",
  "prefixes": [
    403836,
    411156,
    411157,
    411158,
    411159,
    411160,
    433383,
    433384,
    494063,
    494064,
    521394,
    521827,
    525404,
    530866,
    539703,
    547311,
    549208,
    549394
  ]
}
