{
  "name": "yapikredi",
  "country": "tr",
  "localTitle": "Yap覺 ve Kredi Bankas覺",
  "engTitle": "Yap覺 ve Kredi Bankas覺",
  "url": "http://yapikredi.com.tr/",
  "color": "#4285f4",
  "prefixes": [
    404809,
    446212,
    450634,
    455359,
    477959,
    479794,
    479795,
    491205,
    491206,
    492128,
    492130,
    492131,
    510054,
    540061,
    540062,
    540063,
    540122,
    540129,
    542117,
    545103,
    552645,
    552659,
    554422
  ]
}
