{
  "name": "finansbank",
  "country": "tr",
  "localTitle": "Finansbank",
  "engTitle": "Finansbank",
  "url": "https://finansbank.com.tr/",
  "color": "#4285f4",
  "prefixes": [
    402277,
    402278,
    402563,
    403082,
    409364,
    410147,
    413583,
    414388,
    415565,
    422376,
    423277,
    423398,
    427311,
    435653,
    441007,
    444029,
    499850,
    499851,
    499852,
    519324,
    521022,
    521836,
    529572,
    531157,
    545120,
    545616,
    545847,
    547567,
    547800
  ]
}
