{
  "name": "metabank",
  "country": "us",
  "localTitle": "Metabank",
  "engTitle": "Metabank",
  "url": "https://www.metabank.com/",
  "color": "#004990",
  "prefixes": [
    404195,
    419672,
    432732,
    435899,
    441709,
    446106,
    460005,
    472776,
    475034,
    475423,
    475427,
    487211,
    531108
  ]
}
