{
  "name": "fubon",
  "country": "tw",
  "localTitle": "台北富邦銀行",
  "engTitle": "Taipei Fubon Bank",
  "url": "https://www.fubon.com",
  "color": "#007c97",
  "prefixes": [
    400357,
    402987,
    410523,
    436314,
    451445,
    457952,
    457953,
    457956,
    457957,
    462410,
    463781,
    469531,
    472634,
    472635,
    481509,
    492496,
    498713,
    515709,
    515716,
    517951,
    523764,
    524108,
    524132,
    524264,
    540945,
    540966,
    543377,
    543381,
    546600,
    552046,
    552345,
    555033,
    558805
  ]
}
