{
  "name": "esunbank",
  "country": "tw",
  "localTitle": "玉山銀行",
  "engTitle": "E.SUN Bank",
  "url": "https://www.esunbank.com.tw",
  "color": "#009d99",
  "prefixes": [
    404381,
    409679,
    416210,
    439237,
    457966,
    457967,
    461160,
    464961,
    483138,
    486606,
    511098,
    512211,
    512308,
    515717,
    515879,
    515898,
    519933,
    519934,
    519935,
    520063,
    520119,
    521129,
    522225,
    522831,
    523903,
    523976,
    524255,
    528602,
    528950,
    539228,
    539231,
    542462,
    542700,
    552199,
    555029
  ]
}
