{
  "name": "ziraatbankasi",
  "country": "tr",
  "localTitle": "Ziraat Bankası",
  "engTitle": "Ziraat Bankası",
  "url": "http://ziraatbank.com.tr",
  "color": "#4285f4",
  "prefixes": [
    413226,
    444676,
    444677,
    444678,
    453955,
    453956,
    454671,
    454672,
    454673,
    454674,
    454894,
    540130,
    540134,
    541001,
    541033,
    542374,
    547287
  ]
}
