{
  "name": "kuveytturk",
  "country": "tr",
  "localTitle": "Kuveyt Türk",
  "engTitle": "Kuveyt Türk",
  "url": "https://kuveytturk.com.tr/",
  "color": "#4285f4",
  "prefixes": [
    402589,
    402590,
    402592,
    403360,
    403810,
    410555,
    410556,
    424487,
    431024,
    511660,
    512595,
    518896,
    520180,
    525312,
    547564
  ]
}
