{
  "name": "natwest",
  "country": "gb",
  "localTitle": "NatWest",
  "engTitle": "NatWest",
  "url": "http://personal.natwest.com/personal.html",
  "color": "#42145f",
  "prefixes": [
    426326,
    475117,
    475128,
    475129,
    475131,
    490743,
    490946,
    493600,
    493601,
    493602,
    493603,
    493604,
    493605,
    493606,
    493607,
    493608,
    493609,
    493610,
    493611,
    493612,
    493613,
    493614,
    493615,
    493616,
    493617,
    493618,
    493619,
    493620,
    493621,
    493622,
    493623,
    493624,
    493625,
    493626,
    493627,
    493628,
    493629,
    493630,
    493631,
    493632,
    493633,
    493634,
    493635,
    493636,
    493637,
    493638,
    493639,
    493640,
    493641,
    493642,
    493643,
    493644,
    493645,
    493646,
    493647,
    493648,
    493649,
    493650,
    493651,
    493652,
    493653,
    493655,
    493657,
    493658,
    493659,
    493661,
    493662,
    493663,
    493664,
    493665,
    493666,
    493667,
    493668,
    493669,
    493670,
    493671,
    493672,
    493673,
    493674,
    493675,
    493676,
    493677,
    493678,
    493679,
    493680,
    493681,
    493682,
    493683,
    493684,
    493685,
    493686,
    493687,
    493689,
    493690,
    493691,
    493692,
    493693,
    493694,
    493695,
    493696,
    493697,
    543166,
    545107,
    545108,
    545110,
    545112,
    545113,
    545121,
    545130,
    545135,
    545145,
    545149,
    545152,
    545154,
    545175,
    545176,
    545187,
    545188,
    545191,
    545461,
    545475,
    545486,
    545501,
    545513,
    545514,
    545515,
    545516,
    545517,
    545518,
    545520,
    545521,
    545522,
    545523,
    545524,
    552211,
    552217,
    552222,
    552230,
    552242,
    552249,
    552270,
    552272,
    552276,
    552282,
    552294,
    552295,
    552296,
    552298,
    675958,
    675961,
    675962,
    675977,
    675978,
    675998,
    676215,
    676701,
    676709,
    676718,
    676750,
    676751,
    676752,
    676753,
    676754,
    676755,
    676756,
    676757,
    676758,
    676759,
    676760,
    676761,
    676762,
    676798,
    676819,
    677121
  ]
}
