{
  "name": "belveb",
  "country": "by",
  "localTitle": "Банк БелВЭБ",
  "engTitle": "BelVEB Bank",
  "url": "http://www.bveb.by/",
  "color": "#f37637",
  "prefixes": [
    414088,
    414297,
    414298,
    422887,
    447514,
    447515,
    470469,
    499835,
    520658,
    537000,
    544206,
    544578,
    544650,
    547747,
    548475
  ]
}
